{"actionTrace":[{"action":"route","observedResult":"accepted","parameters":{"option":0}},{"action":"assign","observedResult":"accepted","parameters":{"agentID":"stacks","option":0,"taskID":"A9974718-7B4D-2B6F-F7C8-D42E07A9CB3D"}},{"action":"assign","observedResult":"accepted","parameters":{"agentID":"brio","option":0,"taskID":"A9974718-7B4D-2B6F-F7C8-D42E07A9CB3D"}},{"action":"delegate","observedResult":"accepted","parameters":{"option":0,"taskID":"A9974718-7B4D-2B6F-F7C8-D42E07A9CB3D"}},{"action":"reload","observedResult":"invariant_violation","parameters":{"option":0}}],"authority":"observation_only","evidenceReferences":[{"path":"Documentation/ChaosCrew/C2/FinalEvidence/agent-assignment-v2-s19006-min-save_reload_reportCache.json","sha256":"1bb6e46662d9bf1ea531a16ca5a6b52ebc7d48968349e7aa8039736a4cbf7372"}],"expectedBehavior":"Production contract must preserve save_reload:reportCache","id":"CF-c2-95f4e5a6cf0f","invariantViolation":"save_reload:reportCache","missionId":"agent-assignment","observedBehavior":"Source-backed observer flagged save_reload:reportCache; candidate requires review","reproductionStatus":"REPRODUCED","reviewStatus":"CANDIDATE","scenarioId":"agent-assignment-v2-s19006","schemaVersion":"1","seed":19006,"sourceFingerprint":"2794faf488926ac52af08a87b31a949e09d60cdbd7f2ba6d79246d02f660bc04"}
