{"actionTrace":[{"action":"route","observedResult":"accepted","parameters":{"option":0}},{"action":"assign","observedResult":"accepted","parameters":{"agentID":"brio","option":0,"taskID":"A07EC251-8AC2-0282-BCD9-44BDF6F0416D"}},{"action":"delegate","observedResult":"accepted","parameters":{"option":0,"taskID":"A07EC251-8AC2-0282-BCD9-44BDF6F0416D"}},{"action":"review","observedResult":"accepted","parameters":{"option":0,"taskID":"A07EC251-8AC2-0282-BCD9-44BDF6F0416D"}},{"action":"taskResolution","observedResult":"accepted","parameters":{"option":3,"taskID":"A07EC251-8AC2-0282-BCD9-44BDF6F0416D"}},{"action":"reload","observedResult":"invariant_violation","parameters":{"option":0}}],"authority":"observation_only","evidenceReferences":[{"path":"Documentation/ChaosCrew/C2/FinalEvidence/agent-assignment-v2-s19027-min-save_reload_evidence.json","sha256":"864114dd3e970f088620ff3ecbf3777f3e50aa55dd6651a8261e43aecd982b65"}],"expectedBehavior":"Production contract must preserve save_reload:evidence","id":"CF-c2-c83e56adeb2a","invariantViolation":"save_reload:evidence","missionId":"agent-assignment","observedBehavior":"Source-backed observer flagged save_reload:evidence; candidate requires review","reproductionStatus":"REPRODUCED","reviewStatus":"CANDIDATE","scenarioId":"agent-assignment-v2-s19027","schemaVersion":"1","seed":19027,"sourceFingerprint":"2794faf488926ac52af08a87b31a949e09d60cdbd7f2ba6d79246d02f660bc04"}
