{"actionTrace":[{"action":"review","observedResult":"rejected_by_design","parameters":{"option":0,"taskID":"92B4722D-BC56-B938-60A0-0EA83DD6AD8F"}},{"action":"review","observedResult":"invariant_violation","parameters":{"option":0,"taskID":"92B4722D-BC56-B938-60A0-0EA83DD6AD8F"}}],"authority":"observation_only","evidenceReferences":[{"path":"Documentation/ChaosCrew/C1/Evidence/controlled-defect-minimized.json","sha256":"8773dc4d92d194398c693db0a63db4f2968b0a239c1d5976cdb4cb5b198b7bd4"}],"expectedBehavior":"CONTROLLED TEST-ONLY OBSERVER: duplicate review must not be reported as accepted","id":"CF-c1-d4558cea4b9f","invariantViolation":"synthetic_duplicate_review","missionId":"launch","observedBehavior":"CONTROLLED TEST-ONLY OBSERVER DEFECT; not a production incident","reproductionStatus":"REPRODUCED","reviewStatus":"CANDIDATE","scenarioId":"launch-v1-s18180","schemaVersion":"1","seed":18180,"sourceFingerprint":"1cd8603413402d400770cbb0be73ba1798445640df10ceaa26f1eca329f20c7a"}
